{
  "$schema": "../../architecture/quality-manifest.schema.json",
  "schemaVersion": 1,
  "featureId": "ux-02-guided-calibration",
  "requirements": ["UX-02"],
  "owner": "plan-02-28",
  "acceptance": {
    "security": {
      "status": "tested",
      "evidence": [
        {
          "id": "ux-02-calibration-guards",
          "command": "pnpm --filter @liiiraa/feature-shell test -- --run -t \"UX-02|calibration\"",
          "file": "packages/feature-shell/src/machines/calibration.machine.test.ts",
          "owner": "plan-02-28",
          "status": "planned"
        }
      ]
    },
    "privacy": {
      "status": "tested",
      "evidence": [
        {
          "id": "ux-02-consent-and-local-state",
          "command": "pnpm --filter @liiiraa/feature-shell test -- --run -t \"UX-02|calibration\"",
          "file": "packages/feature-shell/src/machines/calibration.machine.test.ts",
          "owner": "plan-02-28",
          "status": "planned"
        }
      ]
    },
    "accessibility": {
      "status": "tested",
      "evidence": [
        {
          "id": "ux-02-calibration-semantics",
          "command": "pnpm --filter @liiiraa/feature-shell test -- --run -t \"shell states|accessibility\"",
          "file": "packages/feature-shell/src/features/shell-features.test.tsx",
          "owner": "plan-02-28",
          "status": "planned"
        },
        {
          "id": "ux-02-browser-keyboard-axe",
          "command": "pnpm --filter @liiiraa/desktop test:e2e -- --project chromium --grep \"@a11y-visual-smoke\"",
          "file": "apps/desktop/tests/browser/accessibility.spec.ts",
          "owner": "plan-02-28",
          "status": "planned"
        }
      ]
    },
    "performance": {
      "status": "tested",
      "evidence": [
        {
          "id": "ux-02-packaged-calibration-performance",
          "command": "pnpm --filter @liiiraa/desktop test:packaged -- --grep \"@performance-smoke\"",
          "file": "apps/desktop/tests/packaged/performance.ts",
          "owner": "plan-02-28",
          "status": "planned"
        }
      ]
    },
    "recovery": {
      "status": "tested",
      "evidence": [
        {
          "id": "ux-02-calibration-resume-migration",
          "command": "pnpm --filter @liiiraa/feature-shell test -- --run -t \"snapshot|invariant|revalidation\"",
          "file": "packages/feature-shell/src/machines/calibration.machine.test.ts",
          "owner": "plan-02-28",
          "status": "planned"
        }
      ]
    }
  }
}
