{
  "$schema": "../../architecture/quality-manifest.schema.json",
  "schemaVersion": 1,
  "featureId": "web-02-versioned-documentation",
  "requirements": ["WEB-02"],
  "owner": "plan-03-32",
  "acceptance": {
    "security": {
      "status": "tested",
      "evidence": [
        {
          "id": "web-02-route-boundaries",
          "command": "pnpm web:test",
          "file": "tooling/web-evidence/src/route-manifest.test.ts",
          "owner": "plan-03-32",
          "status": "passed"
        }
      ]
    },
    "privacy": {
      "status": "tested",
      "evidence": [
        {
          "id": "web-02-search-privacy",
          "command": "pnpm --filter @liiiraa/web-evidence exec playwright test",
          "file": "tooling/web-evidence/tests/documentation.spec.ts",
          "owner": "plan-03-32",
          "status": "passed"
        }
      ]
    },
    "accessibility": {
      "status": "tested",
      "evidence": [
        {
          "id": "web-02-documentation-reflow",
          "command": "pnpm --filter @liiiraa/web-evidence exec playwright test",
          "file": "tooling/web-evidence/tests/accessibility-responsive.spec.ts",
          "owner": "plan-03-32",
          "status": "passed"
        }
      ]
    },
    "performance": {
      "status": "tested",
      "evidence": [
        {
          "id": "web-02-documentation-performance",
          "command": "pnpm --filter @liiiraa/web-evidence exec playwright test",
          "file": "tooling/web-evidence/tests/documentation.spec.ts",
          "owner": "plan-03-32",
          "status": "passed"
        }
      ]
    },
    "recovery": {
      "status": "tested",
      "evidence": [
        {
          "id": "web-02-stale-document-recovery",
          "command": "pnpm --filter @liiiraa/web-evidence exec playwright test",
          "file": "tooling/web-evidence/tests/documentation.spec.ts",
          "owner": "plan-03-32",
          "status": "passed"
        }
      ]
    }
  }
}
