{
  "$schema": "../../architecture/quality-manifest.schema.json",
  "schemaVersion": 1,
  "featureId": "ux-09-truthful-feedback-channels",
  "requirements": ["UX-09"],
  "owner": "plan-02-29",
  "acceptance": {
    "security": {
      "status": "tested",
      "evidence": [
        {
          "id": "ux-09-notification-category-allowlist",
          "command": "pnpm --filter @liiiraa/feature-shell test -- --run -t \"UX-05|UX-06|UX-08|UX-09\"",
          "file": "packages/feature-shell/src/model/interaction-policy.test.ts",
          "owner": "plan-02-29",
          "status": "planned"
        },
        {
          "id": "ux-09-validated-native-notification",
          "command": "pnpm --filter @liiiraa/desktop test -- --run -t \"shell bridge\"",
          "file": "apps/desktop/src/native/shell-bridge.test.ts",
          "owner": "plan-02-29",
          "status": "planned"
        }
      ]
    },
    "privacy": {
      "status": "tested",
      "evidence": [
        {
          "id": "ux-09-redacted-notification-copy",
          "command": "pnpm --filter @liiiraa/feature-shell test -- --run -t \"UX-05|UX-06|UX-08|UX-09\"",
          "file": "packages/feature-shell/src/model/interaction-policy.test.ts",
          "owner": "plan-02-29",
          "status": "planned"
        }
      ]
    },
    "accessibility": {
      "status": "tested",
      "evidence": [
        {
          "id": "ux-09-feedback-live-regions",
          "command": "pnpm --filter @liiiraa/desktop test:e2e -- --project chromium --grep \"@a11y-visual-smoke\"",
          "file": "apps/desktop/tests/browser/accessibility.spec.ts",
          "owner": "plan-02-29",
          "status": "planned"
        }
      ]
    },
    "performance": {
      "status": "tested",
      "evidence": [
        {
          "id": "ux-09-native-feedback-performance",
          "command": "pnpm --filter @liiiraa/desktop test:packaged -- --grep \"@performance-smoke\"",
          "file": "apps/desktop/tests/packaged/performance.ts",
          "owner": "plan-02-29",
          "status": "planned"
        }
      ]
    },
    "recovery": {
      "status": "tested",
      "evidence": [
        {
          "id": "ux-09-native-notification-lifecycle",
          "command": "pnpm --filter @liiiraa/desktop test:packaged -- --grep \"@install-smoke|@native-smoke\"",
          "file": "apps/desktop/tests/packaged/journeys.ts",
          "owner": "plan-02-29",
          "status": "planned"
        },
        {
          "id": "ux-09-feedback-route-recovery",
          "command": "pnpm --filter @liiiraa/desktop test:e2e -- --project chromium --grep \"@route-scenario-smoke\"",
          "file": "apps/desktop/tests/browser/scenarios.spec.ts",
          "owner": "plan-02-29",
          "status": "planned"
        }
      ]
    }
  }
}
