{
  "$schema": "../../architecture/quality-manifest.schema.json",
  "schemaVersion": 1,
  "featureId": "web-01-public-product-evidence",
  "requirements": ["WEB-01"],
  "owner": "plan-03-32",
  "acceptance": {
    "security": {
      "status": "tested",
      "evidence": [
        {
          "id": "web-01-public-artifact-security",
          "command": "pnpm --filter @liiiraa/web-evidence exec playwright test",
          "file": "tooling/web-evidence/tests/security-artifacts.spec.ts",
          "owner": "plan-03-32",
          "status": "passed"
        }
      ]
    },
    "privacy": {
      "status": "tested",
      "evidence": [
        {
          "id": "web-01-public-privacy",
          "command": "pnpm --filter @liiiraa/web-evidence exec playwright test",
          "file": "tooling/web-evidence/tests/public.spec.ts",
          "owner": "plan-03-32",
          "status": "passed"
        }
      ]
    },
    "accessibility": {
      "status": "tested",
      "evidence": [
        {
          "id": "web-01-public-accessibility",
          "command": "pnpm --filter @liiiraa/web-evidence exec playwright test",
          "file": "tooling/web-evidence/tests/accessibility-responsive.spec.ts",
          "owner": "plan-03-32",
          "status": "passed"
        }
      ]
    },
    "performance": {
      "status": "tested",
      "evidence": [
        {
          "id": "web-01-public-performance",
          "command": "pnpm --filter @liiiraa/web-evidence exec playwright test",
          "file": "tooling/web-evidence/tests/public.spec.ts",
          "owner": "plan-03-32",
          "status": "passed"
        }
      ]
    },
    "recovery": {
      "status": "tested",
      "evidence": [
        {
          "id": "web-01-public-recovery",
          "command": "pnpm --filter @liiiraa/web-evidence exec playwright test",
          "file": "tooling/web-evidence/tests/public.spec.ts",
          "owner": "plan-03-32",
          "status": "passed"
        }
      ]
    }
  }
}
