{
  "$schema": "../../architecture/quality-manifest.schema.json",
  "schemaVersion": 1,
  "featureId": "found-01-generated-contracts",
  "requirements": ["FOUND-01"],
  "owner": "plan-01-18",
  "acceptance": {
    "security": {
      "status": "tested",
      "evidence": [
        {
          "id": "found-01-security-validation",
          "command": "pnpm test:contracts",
          "file": "packages/contracts-ts/src/validation.test.ts",
          "owner": "plan-01-18",
          "status": "planned"
        }
      ]
    },
    "privacy": {
      "status": "tested",
      "evidence": [
        {
          "id": "found-01-privacy-redaction",
          "command": "pnpm test:contracts",
          "file": "packages/contracts-ts/src/validation.test.ts",
          "owner": "plan-01-18",
          "status": "planned"
        }
      ]
    },
    "accessibility": {
      "status": "tested",
      "evidence": [
        {
          "id": "found-01-accessible-status-contract",
          "command": "pnpm test:contracts",
          "file": "packages/contracts-ts/src/validation.test.ts",
          "owner": "plan-01-18",
          "status": "planned"
        }
      ]
    },
    "performance": {
      "status": "tested",
      "evidence": [
        {
          "id": "found-01-validator-cache",
          "command": "pnpm test:contracts",
          "file": "packages/contracts-ts/src/validation.test.ts",
          "owner": "plan-01-18",
          "status": "planned"
        }
      ]
    },
    "recovery": {
      "status": "tested",
      "evidence": [
        {
          "id": "found-01-compatibility-recovery",
          "command": "pnpm test:contracts",
          "file": "crates/contracts-rust/tests/golden_corpus.rs",
          "owner": "plan-01-18",
          "status": "planned"
        }
      ]
    }
  }
}
