{
  "$schema": "../../architecture/quality-manifest.schema.json",
  "schemaVersion": 1,
  "featureId": "ux-08-prioritized-activity-history",
  "requirements": ["UX-08"],
  "owner": "plan-02-29",
  "acceptance": {
    "security": {
      "status": "tested",
      "evidence": [
        {
          "id": "ux-08-critical-activity-policy",
          "command": "pnpm --filter @liiiraa/feature-shell test -- --run -t \"UX-05|UX-06|UX-08|UX-09\"",
          "file": "packages/feature-shell/src/model/interaction-policy.test.ts",
          "owner": "plan-02-29",
          "status": "planned"
        }
      ]
    },
    "privacy": {
      "status": "tested",
      "evidence": [
        {
          "id": "ux-08-bounded-activity-retention",
          "command": "pnpm --filter @liiiraa/feature-shell test -- --run -t \"UX-05|UX-06|UX-08|UX-09\"",
          "file": "packages/feature-shell/src/model/interaction-policy.test.ts",
          "owner": "plan-02-29",
          "status": "planned"
        }
      ]
    },
    "accessibility": {
      "status": "tested",
      "evidence": [
        {
          "id": "ux-08-activity-keyboard-semantics",
          "command": "pnpm --filter @liiiraa/feature-shell test -- --run -t \"shell states|accessibility\"",
          "file": "packages/feature-shell/src/features/shell-features.test.tsx",
          "owner": "plan-02-29",
          "status": "planned"
        },
        {
          "id": "ux-08-activity-browser-axe",
          "command": "pnpm --filter @liiiraa/desktop test:e2e -- --project chromium --grep \"@a11y-visual-smoke\"",
          "file": "apps/desktop/tests/browser/accessibility.spec.ts",
          "owner": "plan-02-29",
          "status": "planned"
        }
      ]
    },
    "performance": {
      "status": "tested",
      "evidence": [
        {
          "id": "ux-08-thousand-row-activity-performance",
          "command": "pnpm --filter @liiiraa/desktop test:packaged -- --grep \"@performance-smoke\"",
          "file": "apps/desktop/tests/packaged/performance.ts",
          "owner": "plan-02-29",
          "status": "planned"
        }
      ]
    },
    "recovery": {
      "status": "tested",
      "evidence": [
        {
          "id": "ux-08-durable-history-restart",
          "command": "pnpm --filter @liiiraa/desktop test:packaged -- --grep \"@install-smoke|@native-smoke\"",
          "file": "apps/desktop/tests/packaged/journeys.ts",
          "owner": "plan-02-29",
          "status": "planned"
        },
        {
          "id": "ux-08-canonical-activity-parity",
          "command": "pnpm --filter @liiiraa/desktop test:e2e -- --project chromium --grep \"@route-scenario-smoke\"",
          "file": "apps/desktop/tests/browser/scenarios.spec.ts",
          "owner": "plan-02-29",
          "status": "planned"
        }
      ]
    }
  }
}
